{
  "surfaceId": "tenant-admin.users.roles-keys",
  "version": "0.3.0",
  "title": "Role Assignment & Key Inventory",
  "status": "draft",
  "description": "Read-only inventory of VistA security keys with holder cross-reference. Keys defined in File 19.1, holder lookup via ^XUSEC global, verification via ORWU HASKEY RPC. Categorized as clinical vs administrative. Shows holder count, assigned users, and File 19.1 IEN grounding. Key assignment and revocation require guided terminal workflows.",
  "workspaceFamily": "tenant-admin",
  "navigationLevel": "local",
  "surfaceType": "admin",
  "accessRequirements": {
    "allowedRoles": ["tenant-admin"],
    "scopePosture": "tenant-scoped",
    "entityContextRequired": ["tenantId"]
  },
  "readWritePosture": "read-only",
  "directWriteAllowed": false,
  "dataSources": [
    {
      "sourceId": "vista-file-200-keys",
      "sourceDomainClass": "vista-operational-truth",
      "description": "VistA user key assignments from File 200 KEYS subfile (200.051) — read-only mirror."
    },
    {
      "sourceId": "vista-file-19-1",
      "sourceDomainClass": "vista-operational-truth",
      "description": "VistA security key definitions from File 19.1. Fast holder lookup: ^XUSEC(keyName,DUZ). RPC: ORWU HASKEY.",
      "vistaLookup": "^XUSEC(KEY_NAME,USER_IEN)",
      "rpcs": ["ORWU HASKEY", "XUS ALLKEYS"]
    }
  ],
  "dataClassification": "configuration",
  "claimSurface": null,
  "analyticsSurface": null,
  "crossWorkspaceTransitions": [],
  "readinessDependencies": [],
  "refreshBehavior": "on-demand"
}
